[
  {
    "case_id": "0001",
    "pre_source": "TEST_MATRIX_PRE_NUMEROLOGIE_PURE.md",
    "pre": {
      "A": [
        0,
        0,
        0,
        0,
        0
      ],
      "B": [
        0,
        0,
        0
      ]
    },
    "post": {
      "A": null,
      "B": null
    },
    "verdict_E": "INCOMPATIBLE"
  },
  {
    "case_id": "0002",
    "pre_source": "TEST_MATRIX_PRE_GUT_NAIF.md",
    "pre": {
      "A": [
        2,
        2,
        1,
        1,
        0
      ],
      "B": [
        1,
        1,
        1
      ]
    },
    "post": {
      "A": null,
      "B": null
    },
    "verdict_E": "INCOMPATIBLE"
  },
  {
    "case_id": "0003",
    "pre_source": "TEST_MATRIX_PRE_GUT_SERIEUX_INCOMPLET.md",
    "pre": {
      "A": [
        2,
        2,
        2,
        1,
        1
      ],
      "B": [
        2,
        2,
        2
      ]
    },
    "post": {
      "A": null,
      "B": null
    },
    "verdict_E": "INCONCLUSIF"
  }
]